<?xml version="1.0"?>
<!DOCTYPE list [
        <!ELEMENT list (man | woman)*>
        <!ELEMENT man (sons, daughters)>
        <!ATTLIST man name CDATA #REQUIRED>
        <!ELEMENT woman (sons, daughters)>
        <!ATTLIST woman name CDATA #REQUIRED>
        <!ELEMENT sons (man)*>
        <!ELEMENT daughters (woman)*>
        ]>
<list>
<man name="Julien">
<sons>
</sons>
<daughters>
<man name="Julien">
<sons>
</sons>
<daughters>
<man name="Julien">
<sons>
</sons>
<daughters>
<man name="Julien">
<sons>
</sons>
<daughters>
<man name="Julien">
<sons>
</sons>
<daughters>
<man name="Julien">
<sons>
</sons>
<daughters>
<man name="Julien">
<sons>
</sons>
<daughters>
<man name="Julien">
<sons>
</sons>
<daughters>
<man name="Julien">
<sons>
</sons>
<daughters>
<man name="Julien">
<sons>
</sons>
<daughters>
<man name="Julien">
<sons>
</sons>
<daughters>
<man name="Julien">
<sons>
</sons>
<daughters>
<man name="Julien">
<sons>
</sons>
<daughters>
<man name="Julien">
<sons>
</sons>
<daughters>
<man name="Julien">
<sons>
</sons>
<daughters>
<man name="Julien">
<sons>
</sons>
<daughters>
<man name="Julien">
<sons>
</sons>
<daughters>
<man name="Julien">
<sons>
</sons>
<daughters>
<man name="Julien">
<sons>
</sons>
<daughters>
<man name="Julien">
<sons>
</sons>
<daughters>
<man name="Julien">
<sons>
</sons>
<daughters>
<man name="Julien">
<sons>
</sons>
<daughters>
<man name="Julien">
<sons>
</sons>
<daughters>
<man name="Julien">
<sons>
</sons>
<daughters>
<man name="Julien">
<sons>
</sons>
<daughters>
<man name="Julien">
<sons>
</sons>
<daughters>
<man name="Julien">
<sons>
</sons>
<daughters>
<man name="Julien">
<sons>
</sons>
<daughters>
<man name="Julien">
<sons>
</sons>
<daughters>
<man name="Julien">
<sons>
</sons>
<daughters>
<man name="Julien">
<sons>
</sons>
<daughters>
<man name="Julien">
<sons>
</sons>
<daughters>
<man name="Julien">
<sons>
</sons>
<daughters>
<man name="Julien">
<sons>
</sons>
<daughters>
<man name="Julien">
<sons>
</sons>
<daughters>
<man name="Julien">
<sons>
</sons>
<daughters>
<man name="Julien">
<sons>
</sons>
<daughters>
<man name="Julien">
<sons>
</sons>
<daughters>
<man name="Julien">
<sons>
</sons>
<daughters>
<man name="Julien">
<sons>
</sons>
<daughters>
<man name="Julien">
<sons>
</sons>
<daughters>
<man name="Julien">
<sons>
</sons>
<daughters>
<man name="Julien">
<sons>
</sons>
<daughters>
<man name="Julien">
<sons>
</sons>
<daughters>
<man name="Julien">
<sons>
</sons>
<daughters>
<man name="Julien">
<sons>
</sons>
<daughters>
<man name="Julien">
<sons>
</sons>
<daughters>
<man name="Julien">
<sons>
</sons>
<daughters>
<man name="Julien">
<sons>
</sons>
<daughters>
<man name="Julien">
<sons>
</sons>
<daughters>
<man name="Julien">
<sons>
</sons>
<daughters>
<man name="Julien">
<sons>
</sons>
<daughters>
<man name="Julien">
<sons>
</sons>
<daughters>
<man name="Julien">
<sons>
</sons>
<daughters>
<man name="Julien">
<sons>
</sons>
<daughters>
<man name="Julien">
<sons>
</sons>
<daughters>
<man name="Julien">
<sons>
</sons>
<daughters>
<man name="Julien">
<sons>
</sons>
<daughters>
<man name="Julien">
<sons>
</sons>
<daughters>
<man name="Julien">
<sons>
</sons>
<daughters>
<man name="Julien">
<sons>
</sons>
<daughters>
<man name="Julien">
<sons>
</sons>
<daughters>
<man name="Julien">
<sons>
</sons>
<daughters>
<man name="Julien">
<sons>
</sons>
<daughters>
<man name="Julien">
<sons>
</sons>
<daughters>
<man name="Julien">
<sons>
</sons>
<daughters>
<man name="Julien">
<sons>
</sons>
<daughters>
<man name="Julien">
<sons>
</sons>
<daughters>
<man name="Julien">
<sons>
</sons>
<daughters>
<man name="Julien">
<sons>
</sons>
<daughters>
<man name="Julien">
<sons>
</sons>
<daughters>
<man name="Julien">
<sons>
</sons>
<daughters>
<man name="Julien">
<sons>
</sons>
<daughters>
<man name="Julien">
<sons>
</sons>
<daughters>
<man name="Julien">
<sons>
</sons>
<daughters>
<man name="Julien">
<sons>
</sons>
<daughters>
<man name="Julien">
<sons>
</sons>
<daughters>
<man name="Julien">
<sons>
</sons>
<daughters>
<man name="Julien">
<sons>
</sons>
<daughters>
<man name="Julien">
<sons>
</sons>
<daughters>
<man name="Julien">
<sons>
</sons>
<daughters>
<man name="Julien">
<sons>
</sons>
<daughters>
<man name="Julien">
<sons>
</sons>
<daughters>
<man name="Julien">
<sons>
</sons>
<daughters>
<man name="Julien">
<sons>
</sons>
<daughters>
<man name="Julien">
<sons>
</sons>
<daughters>
<man name="Julien">
<sons>
</sons>
<daughters>
<man name="Julien">
<sons>
</sons>
<daughters>
<man name="Julien">
<sons>
</sons>
<daughters>
<man name="Julien">
<sons>
</sons>
<daughters>
<man name="Julien">
<sons>
</sons>
<daughters>
<man name="Julien">
<sons>
</sons>
<daughters>
<man name="Julien">
<sons>
</sons>
<daughters>
<man name="Julien">
<sons>
</sons>
<daughters>
<man name="Julien">
<sons>
</sons>
<daughters>
<man name="Julien">
<sons>
</sons>
<daughters>
<man name="Julien">
<sons>
</sons>
<daughters>
<man name="Julien">
<sons>
</sons>
<daughters>
<man name="Julien">
<sons>
</sons>
<daughters>
<man name="Julien">
<sons>
</sons>
<daughters>
<man name="Julien">
<sons>
</sons>
<daughters>
<man name="Julien">
<sons>
</sons>
<daughters>
<man name="Julien">
<sons>
</sons>
<daughters>
<man name="Julien">
<sons>
</sons>
<daughters>
<man name="Julien">
<sons>
</sons>
<daughters>
<man name="Julien">
<sons>
</sons>
<daughters>
<man name="Julien">
<sons>
</sons>
<daughters>
<man name="Julien">
<sons>
</sons>
<daughters>
<man name="Julien">
<sons>
</sons>
<daughters>
<man name="Julien">
<sons>
</sons>
<daughters>
<man name="Julien">
<sons>
</sons>
<daughters>
<man name="Julien">
<sons>
</sons>
<daughters>
<man name="Julien">
<sons>
</sons>
<daughters>
<man name="Julien">
<sons>
</sons>
<daughters>
<man name="Julien">
<sons>
</sons>
<daughters>
<man name="Julien">
<sons>
</sons>
<daughters>
<man name="Julien">
<sons>
</sons>
<daughters>
<man name="Julien">
<sons>
</sons>
<daughters>
<man name="Julien">
<sons>
</sons>
<daughters>
<man name="Julien">
<sons>
</sons>
<daughters>
<man name="Julien">
<sons>
</sons>
<daughters>
<man name="Julien">
<sons>
</sons>
<daughters>
<man name="Julien">
<sons>
</sons>
<daughters>
<man name="Julien">
<sons>
</sons>
<daughters>
<man name="Julien">
<sons>
</sons>
<daughters>
<man name="Julien">
<sons>
</sons>
<daughters>
<man name="Julien">
<sons>
</sons>
<daughters>
<man name="Julien">
<sons>
</sons>
<daughters>
<man name="Julien">
<sons>
</sons>
<daughters>
<man name="Julien">
<sons>
</sons>
<daughters>
<man name="Julien">
<sons>
</sons>
<daughters>
<man name="Julien">
<sons>
</sons>
<daughters>
<man name="Julien">
<sons>
</sons>
<daughters>
<man name="Julien">
<sons>
</sons>
<daughters>
<man name="Julien">
<sons>
</sons>
<daughters>
<man name="Julien">
<sons>
</sons>
<daughters>
<man name="Julien">
<sons>
</sons>
<daughters>
<man name="Julien">
<sons>
</sons>
<daughters>
<man name="Julien">
<sons>
</sons>
<daughters>
<man name="Julien">
<sons>
</sons>
<daughters>
<man name="Julien">
<sons>
</sons>
<daughters>
<man name="Julien">
<sons>
</sons>
<daughters>
<man name="Julien">
<sons>
</sons>
<daughters>
<man name="Julien">
<sons>
</sons>
<daughters>
<man name="Julien">
<sons>
</sons>
<daughters>
<man name="Julien">
<sons>
</sons>
<daughters>
<man name="Julien">
<sons>
</sons>
<daughters>
<man name="Julien">
<sons>
</sons>
<daughters>
<man name="Julien">
<sons>
</sons>
<daughters>
<man name="Julien">
<sons>
</sons>
<daughters>
<man name="Julien">
<sons>
</sons>
<daughters>
<man name="Julien">
<sons>
</sons>
<daughters>
<man name="Julien">
<sons>
</sons>
<daughters>
<man name="Julien">
<sons>
</sons>
<daughters>
<man name="Julien">
<sons>
</sons>
<daughters>
<man name="Julien">
<sons>
</sons>
<daughters>
<man name="Julien">
<sons>
</sons>
<daughters>
<man name="Julien">
<sons>
</sons>
<daughters>
<man name="Julien">
<sons>
</sons>
<daughters>
<man name="Julien">
<sons>
</sons>
<daughters>
<man name="Julien">
<sons>
</sons>
<daughters>
<man name="Julien">
<sons>
</sons>
<daughters>
<man name="Julien">
<sons>
</sons>
<daughters>
<man name="Julien">
<sons>
</sons>
<daughters>
<man name="Julien">
<sons>
</sons>
<daughters>
<man name="Julien">
<sons>
</sons>
<daughters>
<man name="Julien">
<sons>
</sons>
<daughters>
<man name="Julien">
<sons>
</sons>
<daughters>
<man name="Julien">
<sons>
</sons>
<daughters>
<man name="Julien">
<sons>
</sons>
<daughters>
<man name="Julien">
<sons>
</sons>
<daughters>
<man name="Julien">
<sons>
</sons>
<daughters>
<man name="Julien">
<sons>
</sons>
<daughters>
<man name="Julien">
<sons>
</sons>
<daughters>
<man name="Julien">
<sons>
</sons>
<daughters>
<man name="Julien">
<sons>
</sons>
<daughters>
<man name="Julien">
<sons>
</sons>
<daughters>
<man name="Julien">
<sons>
</sons>
<daughters>
<man name="Julien">
<sons>
</sons>
<daughters>
<man name="Julien">
<sons>
</sons>
<daughters>
<man name="Julien">
<sons>
</sons>
<daughters>
<man name="Julien">
<sons>
</sons>
<daughters>
<man name="Julien">
<sons>
</sons>
<daughters>
<man name="Julien">
<sons>
</sons>
<daughters>
<man name="Julien">
<sons>
</sons>
<daughters>
<man name="Julien">
<sons>
</sons>
<daughters>
<man name="Julien">
<sons>
</sons>
<daughters>
<man name="Julien">
<sons>
</sons>
<daughters>
<man name="Julien">
<sons>
</sons>
<daughters>
<man name="Julien">
<sons>
</sons>
<daughters>
<man name="Julien">
<sons>
</sons>
<daughters>
<man name="Julien">
<sons>
</sons>
<daughters>
<man name="Julien">
<sons>
</sons>
<daughters>
<man name="Julien">
<sons>
</sons>
<daughters>
<man name="Julien">
<sons>
</sons>
<daughters>
<man name="Julien">
<sons>
</sons>
<daughters>
<man name="Julien">
<sons>
</sons>
<daughters>
<man name="Julien">
<sons>
</sons>
<daughters>
<man name="Julien">
<sons>
</sons>
<daughters>
<man name="Julien">
<sons>
</sons>
<daughters>
<man name="Julien">
<sons>
</sons>
<daughters>
<man name="Julien">
<sons>
</sons>
<daughters>
<man name="Julien">
<sons>
</sons>
<daughters>
<man name="Julien">
<sons>
</sons>
<daughters>
<man name="Julien">
<sons>
</sons>
<daughters>
<man name="Julien">
<sons>
</sons>
<daughters>
<man name="Julien">
<sons>
</sons>
<daughters>
<man name="Julien">
<sons>
</sons>
<daughters>
<man name="Julien">
<sons>
</sons>
<daughters>
<man name="Julien">
<sons>
</sons>
<daughters>
<man name="Julien">
<sons>
</sons>
<daughters>
<man name="Julien">
<sons>
</sons>
<daughters>
<man name="Julien">
<sons>
</sons>
<daughters>
<man name="Julien">
<sons>
</sons>
<daughters>
<man name="Julien">
<sons>
</sons>
<daughters>
<man name="Julien">
<sons>
</sons>
<daughters>
<man name="Julien">
<sons>
</sons>
<daughters>
<man name="Julien">
<sons>
</sons>
<daughters>
<man name="Julien">
<sons>
</sons>
<daughters>
<man name="Julien">
<sons>
</sons>
<daughters>
<man name="Julien">
<sons>
</sons>
<daughters>
<man name="Julien">
<sons>
</sons>
<daughters>
<man name="Julien">
<sons>
</sons>
<daughters>
<man name="Julien">
<sons>
</sons>
<daughters>
<man name="Julien">
<sons>
</sons>
<daughters>
<man name="Julien">
<sons>
</sons>
<daughters>
<man name="Julien">
<sons>
</sons>
<daughters>
<man name="Julien">
<sons>
</sons>
<daughters>
<man name="Julien">
<sons>
</sons>
<daughters>
<man name="Julien">
<sons>
</sons>
<daughters>
<man name="Julien">
<sons>
</sons>
<daughters>
<man name="Julien">
<sons>
</sons>
<daughters>
<man name="Julien">
<sons>
</sons>
<daughters>
<man name="Julien">
<sons>
</sons>
<daughters>
<man name="Julien">
<sons>
</sons>
<daughters>
<man name="Julien">
<sons>
</sons>
<daughters>
<man name="Julien">
<sons>
</sons>
<daughters>
<man name="Julien">
<sons>
</sons>
<daughters>
<man name="Julien">
<sons>
</sons>
<daughters>
<man name="Julien">
<sons>
</sons>
<daughters>
<man name="Julien">
<sons>
</sons>
<daughters>
<man name="Julien">
<sons>
</sons>
<daughters>
<man name="Julien">
<sons>
</sons>
<daughters>
<man name="Julien">
<sons>
</sons>
<daughters>
<man name="Julien">
<sons>
</sons>
<daughters>
<man name="Julien">
<sons>
</sons>
<daughters>
<man name="Julien">
<sons>
</sons>
<daughters>
<man name="Julien">
<sons>
</sons>
<daughters>
<man name="Julien">
<sons>
</sons>
<daughters>
<man name="Julien">
<sons>
</sons>
<daughters>
<man name="Julien">
<sons>
</sons>
<daughters>
<man name="Julien">
<sons>
</sons>
<daughters>
<man name="Julien">
<sons>
</sons>
<daughters>
<man name="Julien">
<sons>
</sons>
<daughters>
<man name="Julien">
<sons>
</sons>
<daughters>
<man name="Julien">
<sons>
</sons>
<daughters>
<man name="Julien">
<sons>
</sons>
<daughters>
<man name="Julien">
<sons>
</sons>
<daughters>
<man name="Julien">
<sons>
</sons>
<daughters>
<man name="Julien">
<sons>
</sons>
<daughters>
<man name="Julien">
<sons>
</sons>
<daughters>
<man name="Julien">
<sons>
</sons>
<daughters>
<man name="Julien">
<sons>
</sons>
<daughters>
<man name="Julien">
<sons>
</sons>
<daughters>
<man name="Julien">
<sons>
</sons>
<daughters>
<man name="Julien">
<sons>
</sons>
<daughters>
<man name="Julien">
<sons>
</sons>
<daughters>
<man name="Julien">
<sons>
</sons>
<daughters>
<man name="Julien">
<sons>
</sons>
<daughters>
<man name="Julien">
<sons>
</sons>
<daughters>
<man name="Julien">
<sons>
</sons>
<daughters>
<man name="Julien">
<sons>
</sons>
<daughters>
<man name="Julien">
<sons>
</sons>
<daughters>
<man name="Julien">
<sons>
</sons>
<daughters>
<man name="Julien">
<sons>
</sons>
<daughters>
<man name="Julien">
<sons>
</sons>
<daughters>
<man name="Julien">
<sons>
</sons>
<daughters>
<man name="Julien">
<sons>
</sons>
<daughters>
<man name="Julien">
<sons>
</sons>
<daughters>
<man name="Julien">
<sons>
</sons>
<daughters>
<man name="Julien">
<sons>
</sons>
<daughters>
<man name="Julien">
<sons>
</sons>
<daughters>
<man name="Julien">
<sons>
</sons>
<daughters>
<man name="Julien">
<sons>
</sons>
<daughters>
<man name="Julien">
<sons>
</sons>
<daughters>
<man name="Julien">
<sons>
</sons>
<daughters>
<man name="Julien">
<sons>
</sons>
<daughters>
<man name="Julien">
<sons>
</sons>
<daughters>
<man name="Julien">
<sons>
</sons>
<daughters>
<man name="Julien">
<sons>
</sons>
<daughters>
<man name="Julien">
<sons>
</sons>
<daughters>
<man name="Julien">
<sons>
</sons>
<daughters>
<man name="Julien">
<sons>
</sons>
<daughters>
<man name="Julien">
<sons>
</sons>
<daughters>
<man name="Julien">
<sons>
</sons>
<daughters>
<man name="Julien">
<sons>
</sons>
<daughters>
<man name="Julien">
<sons>
</sons>
<daughters>
<man name="Julien">
<sons>
</sons>
<daughters>
<man name="Julien">
<sons>
</sons>
<daughters>
<man name="Julien">
<sons>
</sons>
<daughters>
<man name="Julien">
<sons>
</sons>
<daughters>
<man name="Julien">
<sons>
</sons>
<daughters>
<man name="Julien">
<sons>
</sons>
<daughters>
<man name="Julien">
<sons>
</sons>
<daughters>
<man name="Julien">
<sons>
</sons>
<daughters>
<man name="Julien">
<sons>
</sons>
<daughters>
<man name="Julien">
<sons>
</sons>
<daughters>
<man name="Julien">
<sons>
</sons>
<daughters>
<man name="Julien">
<sons>
</sons>
<daughters>
<man name="Julien">
<sons>
</sons>
<daughters>
<man name="Julien">
<sons>
</sons>
<daughters>
<man name="Julien">
<sons>
</sons>
<daughters>
<man name="Julien">
<sons>
</sons>
<daughters>
<man name="Julien">
<sons>
</sons>
<daughters>
<man name="Julien">
<sons>
</sons>
<daughters>
<man name="Julien">
<sons>
</sons>
<daughters>
<man name="Julien">
<sons>
</sons>
<daughters>
<man name="Julien">
<sons>
</sons>
<daughters>
<man name="Julien">
<sons>
</sons>
<daughters>
<man name="Julien">
<sons>
</sons>
<daughters>
<man name="Julien">
<sons>
</sons>
<daughters>
<man name="Julien">
<sons>
</sons>
<daughters>
<man name="Julien">
<sons>
</sons>
<daughters>
<man name="Julien">
<sons>
</sons>
<daughters>
<man name="Julien">
<sons>
</sons>
<daughters>
<man name="Julien">
<sons>
</sons>
<daughters>
<man name="Julien">
<sons>
</sons>
<daughters>
<man name="Julien">
<sons>
</sons>
<daughters>
<man name="Julien">
<sons>
</sons>
<daughters>
<man name="Julien">
<sons>
</sons>
<daughters>
<man name="Julien">
<sons>
</sons>
<daughters>
<man name="Julien">
<sons>
</sons>
<daughters>
<man name="Julien">
<sons>
</sons>
<daughters>
<man name="Julien">
<sons>
</sons>
<daughters>
<man name="Julien">
<sons>
</sons>
<daughters>
<man name="Julien">
<sons>
</sons>
<daughters>
<man name="Julien">
<sons>
</sons>
<daughters>
<man name="Julien">
<sons>
</sons>
<daughters>
<man name="Julien">
<sons>
</sons>
<daughters>
<man name="Julien">
<sons>
</sons>
<daughters>
<man name="Julien">
<sons>
</sons>
<daughters>
<man name="Julien">
<sons>
</sons>
<daughters>
<man name="Julien">
<sons>
</sons>
<daughters>
<man name="Julien">
<sons>
</sons>
<daughters>
<man name="Julien">
<sons>
</sons>
<daughters>
<man name="Julien">
<sons>
</sons>
<daughters>
<man name="Julien">
<sons>
</sons>
<daughters>
<man name="Julien">
<sons>
</sons>
<daughters>
<man name="Julien">
<sons>
</sons>
<daughters>
<man name="Julien">
<sons>
</sons>
<daughters>
<man name="Julien">
<sons>
</sons>
<daughters>
<man name="Julien">
<sons>
</sons>
<daughters>
<man name="Julien">
<sons>
</sons>
<daughters>
<man name="Julien">
<sons>
</sons>
<daughters>
<man name="Julien">
<sons>
</sons>
<daughters>
<man name="Julien">
<sons>
</sons>
<daughters>
<man name="Julien">
<sons>
</sons>
<daughters>
<man name="Julien">
<sons>
</sons>
<daughters>
<man name="Julien">
<sons>
</sons>
<daughters>
<man name="Julien">
<sons>
</sons>
<daughters>
<man name="Julien">
<sons>
</sons>
<daughters>
<man name="Julien">
<sons>
</sons>
<daughters>
<man name="Julien">
<sons>
</sons>
<daughters>
<man name="Julien">
<sons>
</sons>
<daughters>
<man name="Julien">
<sons>
</sons>
<daughters>
<man name="Julien">
<sons>
</sons>
<daughters>
<man name="Julien">
<sons>
</sons>
<daughters>
<man name="Julien">
<sons>
</sons>
<daughters>
<man name="Julien">
<sons>
</sons>
<daughters>
<man name="Julien">
<sons>
</sons>
<daughters>
<man name="Julien">
<sons>
</sons>
<daughters>
<man name="Julien">
<sons>
</sons>
<daughters>
<man name="Julien">
<sons>
</sons>
<daughters>
<man name="Julien">
<sons>
</sons>
<daughters>
<man name="Julien">
<sons>
</sons>
<daughters>
<man name="Julien">
<sons>
</sons>
<daughters>
<man name="Julien">
<sons>
</sons>
<daughters>
<man name="Julien">
<sons>
</sons>
<daughters>
<man name="Julien">
<sons>
</sons>
<daughters>
<man name="Julien">
<sons>
</sons>
<daughters>
<man name="Julien">
<sons>
</sons>
<daughters>
<man name="Julien">
<sons>
</sons>
<daughters>
<man name="Julien">
<sons>
</sons>
<daughters>
<man name="Julien">
<sons>
</sons>
<daughters>
<man name="Julien">
<sons>
</sons>
<daughters>
<man name="Julien">
<sons>
</sons>
<daughters>
<man name="Julien">
<sons>
</sons>
<daughters>
<man name="Julien">
<sons>
</sons>
<daughters>
<man name="Julien">
<sons>
</sons>
<daughters>
<man name="Julien">
<sons>
</sons>
<daughters>
<man name="Julien">
<sons>
</sons>
<daughters>
<man name="Julien">
<sons>
</sons>
<daughters>
<man name="Julien">
<sons>
</sons>
<daughters>
<man name="Julien">
<sons>
</sons>
<daughters>
<man name="Julien">
<sons>
</sons>
<daughters>
<man name="Julien">
<sons>
</sons>
<daughters>
<man name="Julien">
<sons>
</sons>
<daughters>
<man name="Julien">
<sons>
</sons>
<daughters>
<man name="Julien">
<sons>
</sons>
<daughters>
<man name="Julien">
<sons>
</sons>
<daughters>
<man name="Julien">
<sons>
</sons>
<daughters>
<man name="Julien">
<sons>
</sons>
<daughters>
<man name="Julien">
<sons>
</sons>
<daughters>
<man name="Julien">
<sons>
</sons>
<daughters>
<man name="Julien">
<sons>
</sons>
<daughters>
<man name="Julien">
<sons>
</sons>
<daughters>
<man name="Julien">
<sons>
</sons>
<daughters>
<man name="Julien">
<sons>
</sons>
<daughters>
<man name="Julien">
<sons>
</sons>
<daughters>
<man name="Julien">
<sons>
</sons>
<daughters>
<man name="Julien">
<sons>
</sons>
<daughters>
<man name="Julien">
<sons>
</sons>
<daughters>
<man name="Julien">
<sons>
</sons>
<daughters>
<man name="Julien">
<sons>
</sons>
<daughters>
<man name="Julien">
<sons>
</sons>
<daughters>
<man name="Julien">
<sons>
</sons>
<daughters>
<man name="Julien">
<sons>
</sons>
<daughters>
<man name="Julien">
<sons>
</sons>
<daughters>
<man name="Julien">
<sons>
</sons>
<daughters>
<man name="Julien">
<sons>
</sons>
<daughters>
<man name="Julien">
<sons>
</sons>
<daughters>
<man name="Julien">
<sons>
</sons>
<daughters>
<man name="Julien">
<sons>
</sons>
<daughters>
<man name="Julien">
<sons>
</sons>
<daughters>
<man name="Julien">
<sons>
</sons>
<daughters>
<man name="Julien">
<sons>
</sons>
<daughters>
<man name="Julien">
<sons>
</sons>
<daughters>
<man name="Julien">
<sons>
</sons>
<daughters>
<man name="Julien">
<sons>
</sons>
<daughters>
<man name="Julien">
<sons>
</sons>
<daughters>
<man name="Julien">
<sons>
</sons>
<daughters>
<man name="Julien">
<sons>
</sons>
<daughters>
<man name="Julien">
<sons>
</sons>
<daughters>
<man name="Julien">
<sons>
</sons>
<daughters>
<man name="Julien">
<sons>
</sons>
<daughters>
<man name="Julien">
<sons>
</sons>
<daughters>
<man name="Julien">
<sons>
</sons>
<daughters>
<man name="Julien">
<sons>
</sons>
<daughters>
<man name="Julien">
<sons>
</sons>
<daughters>
<man name="Julien">
<sons>
</sons>
<daughters>
<man name="Julien">
<sons>
</sons>
<daughters>
<man name="Julien">
<sons>
</sons>
<daughters>
<man name="Julien">
<sons>
</sons>
<daughters>
<man name="Julien">
<sons>
</sons>
<daughters>
<man name="Julien">
<sons>
</sons>
<daughters>
<man name="Julien">
<sons>
</sons>
<daughters>
<man name="Julien">
<sons>
</sons>
<daughters>
<man name="Julien">
<sons>
</sons>
<daughters>
<man name="Julien">
<sons>
</sons>
<daughters>
<man name="Julien">
<sons>
</sons>
<daughters>
<man name="Julien">
<sons>
</sons>
<daughters>
<man name="Julien">
<sons>
</sons>
<daughters>
<man name="Julien">
<sons>
</sons>
<daughters>
<man name="Julien">
<sons>
</sons>
<daughters>
<man name="Julien">
<sons>
</sons>
<daughters>
<man name="Julien">
<sons>
</sons>
<daughters>
<man name="Julien">
<sons>
</sons>
<daughters>
<man name="Julien">
<sons>
</sons>
<daughters>
<man name="Julien">
<sons>
</sons>
<daughters>
<man name="Julien">
<sons>
</sons>
<daughters>
<man name="Julien">
<sons>
</sons>
<daughters>
<man name="Julien">
<sons>
</sons>
<daughters>
<man name="Julien">
<sons>
</sons>
<daughters>
<man name="Julien">
<sons>
</sons>
<daughters>
<man name="Julien">
<sons>
</sons>
<daughters>
<man name="Julien">
<sons>
</sons>
<daughters>
<man name="Julien">
<sons>
</sons>
<daughters>
<man name="Julien">
<sons>
</sons>
<daughters>
<man name="Julien">
<sons>
</sons>
<daughters>
<man name="Julien">
<sons>
</sons>
<daughters>
<man name="Julien">
<sons>
</sons>
<daughters>
<man name="Julien">
<sons>
</sons>
<daughters>
<man name="Julien">
<sons>
</sons>
<daughters>
<man name="Julien">
<sons>
</sons>
<daughters>
<man name="Julien">
<sons>
</sons>
<daughters>
<man name="Julien">
<sons>
</sons>
<daughters>
<man name="Julien">
<sons>
</sons>
<daughters>
<man name="Julien">
<sons>
</sons>
<daughters>
<man name="Julien">
<sons>
</sons>
<daughters>
<man name="Julien">
<sons>
</sons>
<daughters>
<man name="Julien">
<sons>
</sons>
<daughters>
<man name="Julien">
<sons>
</sons>
<daughters>
<man name="Julien">
<sons>
</sons>
<daughters>
<man name="Julien">
<sons>
</sons>
<daughters>
<man name="Julien">
<sons>
</sons>
<daughters>
<man name="Julien">
<sons>
</sons>
<daughters>
<man name="Julien">
<sons>
</sons>
<daughters>
<man name="Julien">
<sons>
</sons>
<daughters>
<man name="Julien">
<sons>
</sons>
<daughters>
<man name="Julien">
<sons>
</sons>
<daughters>
<man name="Julien">
<sons>
</sons>
<daughters>
<man name="Julien">
<sons>
</sons>
<daughters>
<man name="Julien">
<sons>
</sons>
<daughters>
<man name="Julien">
<sons>
</sons>
<daughters>
<man name="Julien">
<sons>
</sons>
<daughters>
<man name="Julien">
<sons>
</sons>
<daughters>
<man name="Julien">
<sons>
</sons>
<daughters>
<man name="Julien">
<sons>
</sons>
<daughters>
<man name="Julien">
<sons>
</sons>
<daughters>
<man name="Julien">
<sons>
</sons>
<daughters>
<man name="Julien">
<sons>
</sons>
<daughters>
<man name="Julien">
<sons>
</sons>
<daughters>
<man name="Julien">
<sons>
</sons>
<daughters>
<man name="Julien">
<sons>
</sons>
<daughters>
<man name="Julien">
<sons>
</sons>
<daughters>
<man name="Julien">
<sons>
</sons>
<daughters>
<man name="Julien">
<sons>
</sons>
<daughters>
<man name="Julien">
<sons>
</sons>
<daughters>
<man name="Julien">
<sons>
</sons>
<daughters>
<man name="Julien">
<sons>
</sons>
<daughters>
<man name="Julien">
<sons>
</sons>
<daughters>
<man name="Julien">
<sons>
</sons>
<daughters>
<man name="Julien">
<sons>
</sons>
<daughters>
<man name="Julien">
<sons>
</sons>
<daughters>
<man name="Julien">
<sons>
</sons>
<daughters>
<man name="Julien">
<sons>
</sons>
<daughters>
<man name="Julien">
<sons>
</sons>
<daughters>
<man name="Julien">
<sons>
</sons>
<daughters>
<man name="Julien">
<sons>
</sons>
<daughters>
<man name="Julien">
<sons>
</sons>
<daughters>
<man name="Julien">
<sons>
</sons>
<daughters>
<man name="Julien">
<sons>
</sons>
<daughters>
<man name="Julien">
<sons>
</sons>
<daughters>
<man name="Julien">
<sons>
</sons>
<daughters>
<man name="Julien">
<sons>
</sons>
<daughters>
<man name="Julien">
<sons>
</sons>
<daughters>
<man name="Julien">
<sons>
</sons>
<daughters>
<man name="Julien">
<sons>
</sons>
<daughters>
<man name="Julien">
<sons>
</sons>
<daughters>
<man name="Julien">
<sons>
</sons>
<daughters>
<man name="Julien">
<sons>
</sons>
<daughters>
<man name="Julien">
<sons>
</sons>
<daughters>
<man name="Julien">
<sons>
</sons>
<daughters>
<man name="Julien">
<sons>
</sons>
<daughters>
<man name="Julien">
<sons>
</sons>
<daughters>
<man name="Julien">
<sons>
</sons>
<daughters>
<man name="Julien">
<sons>
</sons>
<daughters>
<man name="Julien">
<sons>
</sons>
<daughters>
<man name="Julien">
<sons>
</sons>
<daughters>
<man name="Julien">
<sons>
</sons>
<daughters>
<man name="Julien">
<sons>
</sons>
<daughters>
<man name="Julien">
<sons>
</sons>
<daughters>
<man name="Julien">
<sons>
</sons>
<daughters>
<man name="Julien">
<sons>
</sons>
<daughters>
<man name="Julien">
<sons>
</sons>
<daughters>
<man name="Julien">
<sons>
</sons>
<daughters>
<man name="Julien">
<sons>
</sons>
<daughters>
<man name="Julien">
<sons>
</sons>
<daughters>
<man name="Julien">
<sons>
</sons>
<daughters>
<man name="Julien">
<sons>
</sons>
<daughters>
<man name="Julien">
<sons>
</sons>
<daughters>
<man name="Julien">
<sons>
</sons>
<daughters>
<man name="Julien">
<sons>
</sons>
<daughters>
<man name="Julien">
<sons>
</sons>
<daughters>
<man name="Julien">
<sons>
</sons>
<daughters>
<man name="Julien">
<sons>
</sons>
<daughters>
<man name="Julien">
<sons>
</sons>
<daughters>
<man name="Julien">
<sons>
</sons>
<daughters>
<man name="Julien">
<sons>
</sons>
<daughters>
<man name="Julien">
<sons>
</sons>
<daughters>
<man name="Julien">
<sons>
</sons>
<daughters>
<man name="Julien">
<sons>
</sons>
<daughters>
<man name="Julien">
<sons>
</sons>
<daughters>
<man name="Julien">
<sons>
</sons>
<daughters>
<man name="Julien">
<sons>
</sons>
<daughters>
<man name="Julien">
<sons>
</sons>
<daughters>
<man name="Julien">
<sons>
</sons>
<daughters>
<man name="Julien">
<sons>
</sons>
<daughters>
<man name="Julien">
<sons>
</sons>
<daughters>
<man name="Julien">
<sons>
</sons>
<daughters>
<man name="Julien">
<sons>
</sons>
<daughters>
<man name="Julien">
<sons>
</sons>
<daughters>
<man name="Julien">
<sons>
</sons>
<daughters>
<man name="Julien">
<sons>
</sons>
<daughters>
<man name="Julien">
<sons>
</sons>
<daughters>
<man name="Julien">
<sons>
</sons>
<daughters>
<man name="Julien">
<sons>
</sons>
<daughters>
<man name="Julien">
<sons>
</sons>
<daughters>
<man name="Julien">
<sons>
</sons>
<daughters>
<man name="Julien">
<sons>
</sons>
<daughters>
<man name="Julien">
<sons>
</sons>
<daughters>
<man name="Julien">
<sons>
</sons>
<daughters>
<man name="Julien">
<sons>
</sons>
<daughters>
<man name="Julien">
<sons>
</sons>
<daughters>
<man name="Julien">
<sons>
</sons>
<daughters>
<man name="Julien">
<sons>
</sons>
<daughters>
<man name="Julien">
<sons>
</sons>
<daughters>
<man name="Julien">
<sons>
</sons>
<daughters>
<man name="Julien">
<sons>
</sons>
<daughters>
<man name="Julien">
<sons>
</sons>
<daughters>
<man name="Julien">
<sons>
</sons>
<daughters>
<man name="Julien">
<sons>
</sons>
<daughters>
<man name="Julien">
<sons>
</sons>
<daughters>
<man name="Julien">
<sons>
</sons>
<daughters>
<man name="Julien">
<sons>
</sons>
<daughters>
<man name="Julien">
<sons>
</sons>
<daughters>
<man name="Julien">
<sons>
</sons>
<daughters>
<man name="Julien">
<sons>
</sons>
<daughters>
<man name="Julien">
<sons>
</sons>
<daughters>
<man name="Julien">
<sons>
</sons>
<daughters>
<man name="Julien">
<sons>
</sons>
<daughters>
<man name="Julien">
<sons>
</sons>
<daughters>
<man name="Julien">
<sons>
</sons>
<daughters>
<man name="Julien">
<sons>
</sons>
<daughters>
<man name="Julien">
<sons>
</sons>
<daughters>
<man name="Julien">
<sons>
</sons>
<daughters>
<man name="Julien">
<sons>
</sons>
<daughters>
<man name="Julien">
<sons>
</sons>
<daughters>
<man name="Julien">
<sons>
</sons>
<daughters>
<man name="Julien">
<sons>
</sons>
<daughters>
<man name="Julien">
<sons>
</sons>
<daughters>
<man name="Julien">
<sons>
</sons>
<daughters>
<man name="Julien">
<sons>
</sons>
<daughters>
<man name="Julien">
<sons>
</sons>
<daughters>
<man name="Julien">
<sons>
</sons>
<daughters>
<man name="Julien">
<sons>
</sons>
<daughters>
<man name="Julien">
<sons>
</sons>
<daughters>
<man name="Julien">
<sons>
</sons>
<daughters>
<man name="Julien">
<sons>
</sons>
<daughters>
<man name="Julien">
<sons>
</sons>
<daughters>
<man name="Julien">
<sons>
</sons>
<daughters>
<man name="Julien">
<sons>
</sons>
<daughters>
<man name="Julien">
<sons>
</sons>
<daughters>
<man name="Julien">
<sons>
</sons>
<daughters>
<man name="Julien">
<sons>
</sons>
<daughters>
<man name="Julien">
<sons>
</sons>
<daughters>
<man name="Julien">
<sons>
</sons>
<daughters>
<man name="Julien">
<sons>
</sons>
<daughters>
<man name="Julien">
<sons>
</sons>
<daughters>
<man name="Julien">
<sons>
</sons>
<daughters>
<man name="Julien">
<sons>
</sons>
<daughters>